text,label
"So good",message
"Love your style",message
"You're amazing",message
"When are you free?",message
"Let's find a time",message
"Work with your schedule",message
"I'm flexible",message
"You pick",message
"Name the place",message
"Your call",message
"Whatever works",message
"I'm easy",message
"Dealer's choice",message
"Need to reschedule",message
"Can we postpone?",message
"Something came up",message
"Have to cancel",message
"Can't make it",message
"Rain check?",message
"Maybe next time",message
"Sorry to bail",message
"Change of plans",message
"Won't be able to",message
"Where are you?",message
"Send location",message
"Turn left",message
"Next block",message
"See you there",message
"At the entrance",message
"Second floor",message
"Near the elevator",message
"By the window",message
"Corner table",message
"What do you think?",message
"Your thoughts?",message
"Any preferences?",message
"Up to you",message
"I'm good either way",message
"Sounds fine",message
"Works for me",message
"I like it",message
"Not a fan",message
"Could be better",message
"Still working on it",message
"Making progress",message
"Halfway there",message
"Should be done soon",message
"Taking longer than expected",message
"Ahead of schedule",message
"Right on track",message
"Almost finished",message
"Few more minutes",message
"Just started",message
"Can you help?",message
"Need a favor",message
"Quick question",message
"Got a sec?",message
"Mind if I ask?",message
"Would you mind?",message
"Could you?",message
"If you don't mind",message
"When you have time",message
"No pressure",message
"I'm around",message
"Free now",message
"Busy at the moment",message
"Tied up",message
"In a bit",message
"Give me 10",message
"Available after lunch",message
"Tomorrow works",message
"Next week?",message
"Anytime today",message
"Still there?",message
"You busy?",message
"Taking a while",message
"Any update?",message
"Heard anything?",message
"Still waiting",message
"Patience is key",message
"Should hear soon",message
"Any day now",message
"Fingers crossed",message
"Let's do it",message
"I'm in",message
"Sounds like a plan",message
"Deal",message
"Agreed",message
"Settled",message
"Final answer",message
"Going with that",message
"That's the one",message
"Perfect choice",message
"Nice day",message
"Too hot",message
"Freezing out",message
"Love this",message
"Hate this weather",message
"Perfect temperature",message
"Need my jacket",message
"Sunscreen weather",message
"Stay dry",message
"Bundle up",message
"Phone froze",message
"App crashed",message
"Connection issues",message
"Can't hear you",message
"Breaking up",message
"Text me instead",message
"Email it",message
"Try again",message
"Restart?",message
"Works now",message
"Got it",message
"Sold out",message
"On backorder",message
"Great find",message
"Total impulse buy",message
"Worth it",message
"Return it",message
"Keep the receipt",message
"Gift wrapped",message
"Free shipping",message
"Big news",message
"Did you hear?",message
"Guess what",message
"You won't believe",message
"Breaking news",message
"Hot gossip",message
"Inside scoop",message
"Word on the street",message
"Rumor has it",message
"I heard",message
"Morning",message
"Good morning",message
"Rise and shine",message
"Early bird",message
"Night owl",message
"Good night",message
"Sweet dreams",message
"Sleep well",message
"Rest up",message
"See you tomorrow",message
"K",message
"Kk",message
"Gotcha",message
"Copy",message
"Noted",message
"Acknowledged",message
"Understood",message
"Clear",message
"Roger",message
"10-4",message
"omg did you see that?!",message
"brb need to grab something",message
"ttyl got a call coming in",message
"nvm I figured it out",message
"thx for earlier really appreciated it",message
"sry totally forgot to respond",message
"idk what to do about this",message
"tbh I'm not sure either",message
"rn I'm stuck in traffic",message
"btw did you finish that thing?",message
"fyi meeting got moved to 3pm",message
"lmk when you're free to talk",message
"asap please this is urgent",message
"jk just kidding around",message
"imo that's the best option",message
"imho we should wait a bit",message
"afaik they haven't decided yet",message
"fwiw I think you're right",message
"tbd we'll figure it out later",message
"eta 10 minutes",message
"omw be there soon",message
"np happy to help",message
"ty so much!",message
"yw anytime!",message
"ikr right?!",message
"fr for real though",message
"lowkey excited about this",message
"highkey stressed rn",message
"ngl I'm impressed",message
"tbf they had a point",message
"smh can't believe it",message
"fomo is real with this one",message
"yolo let's do it",message
"tfw when it finally works",message
"mfw I realized my mistake",message
"tl;dr too long; here's the summary",message
"irl this would never happen",message
"afk for a few minutes",message
"gtg got to go now",message
"bbl be back later",message
"cya see you around",message
"l8r later!",message
"msg me when you can",message
"pls please help with this",message
"thru the drive through",message
"ur your idea is great",message
"w/ with Sarah today",message
"w/o without any issues",message
"b/c because of the delay",message
"ppl people are asking about it",message
"pic picture came out great!",message
"vid video is hilarious",message
"dm me direct message for details",message
"rt retweet that please",message
"def definitely interested",message
"prob probably not going",message
"obv obviously yes",message
"srsly seriously though",message
"rly really appreciate it",message
"tho even though it's late",message
"ppl r people are saying",message
"gonna going to try tomorrow",message
"wanna want to join us?",message
"gotta got to finish this",message
"dunno I don't know yet",message
"kinda sort of makes sense",message
"sorta I kind of agree",message
"prolly probably will work",message
"lemme let me check real quick",message
"gimme give me a sec",message
"gotcha got it, understood",message
"wassup what's up?",message
"sup not much, you?",message
"hey yo what's good?",message
"ayy what's happening?",message
"yo you around?",message
"heyyy with the extra y's",message
"hiii super excited!!",message
"byeee talk soon!!!",message
"k just k nothing else",message
"kk okay okay got it",message
"kkk no wait that means okay",message
"yup that works for me",message
"nope can't make it",message
"yep sounds good to me",message
"nah not interested thanks",message
"yeah for sure let's do it",message
"yea I think so too",message
"nay I vote against it",message
"aye I'm in favor of it",message
"meh I'm indifferent honestly",message
"huh what do you mean?",message
"hmm let me think about it",message
"uhh I'm not sure tbh",message
"umm give me a moment",message
"err that's not quite right",message
"ugh this is so frustrating",message
"gah I messed up again",message
"argh why isn't this working",message
"whoa that's unexpected!",message
"woah didn't see that coming",message
"wow amazing work on this",message
"whew finally done with it",message
"phew that was close!",message
"yay we did it team!",message
"yipee so excited for this!",message
"hooray celebration time!",message
"woot woot let's go!",message
"aww that's so sweet!",message
"awww love this so much",message
"ooh interesting point there",message
"oooh I like that idea",message
"ahh I see what you mean",message
"ahhh now it makes sense",message
"haha that's funny actually",message
"hehe just a little joke",message
"lol laughing out loud here",message
"lolol that's hilarious omg",message
"rofl rolling on floor laughing",message
"lmao laughing my ass off",message
"hahaha can't stop laughing",message
"bahahaha dying over here",message
"ded I'm dead from laughing",message
"crying literal tears rn",message
"weak I'm so weak",message
"shook I'm completely shook",message
"goat greatest of all time",message
"lit this is so lit",message
"fire that's fire content",message
"dope super dope stuff",message
"sick that's sick man",message
"rad totally rad vibes",message
"cool sounds cool to me",message
"nice nice work on that",message
"sweet sweet deal thanks",message
"tight that's tight yo",message
"fresh fresh perspective on it",message
"clean really clean execution",message
"crisp super crisp quality",message
"solid solid plan overall",message
"legit that's legit good",message
"valid your point is valid",message
"facts that's straight facts",message
"truth speaking the truth here",message
"real keeping it real",message
"mood big mood energy",message
"vibe I'm feeling the vibe",message
"energy love the energy",message
"aura great aura about this",message
"The quarterly financial report demonstrates significant growth across all market segments. Revenue increased by 23% compared to the previous quarter.",document
"Executive Summary: This document outlines the strategic initiatives for the upcoming fiscal year. Key priorities include market expansion and operational efficiency.",document
"The research methodology employed in this study utilized a mixed-methods approach combining quantitative surveys with qualitative interviews.",document
"The board of directors convened on October 15th to discuss the proposed merger and acquisition strategy.",document
"Analysis of the data reveals a strong correlation between customer satisfaction scores and retention rates.",document
"The implementation plan consists of three distinct phases executed over a twelve-month period.",document
"Findings from the market research indicate a growing demand for sustainable products among millennial consumers.",document
"The proposed budget allocation prioritizes investments in research and development while maintaining operational expenditures.",document
"The committee recommends adoption of the new policy framework effective January 1st of next year.",document
"Preliminary results suggest that the intervention significantly improved patient outcomes across multiple metrics.",document
"The comprehensive review examined all aspects of the current organizational structure and identified areas for improvement.",document
"Statistical analysis demonstrates a statistically significant difference between the control and experimental groups.",document
"The white paper presents a detailed examination of industry trends and their implications for future growth.",document
"Performance metrics indicate that the initiative exceeded its stated objectives in all key performance indicators.",document
"The strategic plan encompasses both short-term tactical goals and long-term visionary objectives.",document
"Regulatory compliance requirements mandate adherence to established protocols and documentation standards.",document
"The assessment framework evaluates competency across technical skills, leadership capabilities, and strategic thinking.",document
"The annual report provides stakeholders with transparent disclosure of financial performance and operational achievements.",document
"The literature review synthesizes existing research and identifies gaps in current understanding.",document
"Policy recommendations are grounded in evidence-based analysis of program effectiveness and cost-benefit considerations.",document
"System requirements specify minimum hardware configurations necessary for optimal performance of the application.",document
"The architecture diagram illustrates the relationships between various components within the distributed system.",document
"Security protocols implement industry-standard encryption algorithms to protect sensitive user data.",document
"The database schema defines the structure and relationships among tables in the relational database management system.",document
"Version control procedures ensure that all modifications to the codebase are tracked and documented appropriately.",document
"The application programming interface provides standardized methods for third-party integrations.",document
"Performance benchmarks indicate that the optimized algorithm reduces processing time by approximately 40 percent.",document
"The deployment guide outlines step-by-step instructions for configuring the production environment.",document
"Error handling mechanisms capture exceptions and log detailed information for troubleshooting purposes.",document
"The software development lifecycle adheres to agile methodologies with iterative sprint cycles.",document
"The hypothesis posits that increased exposure to educational resources correlates with improved academic outcomes.",document
"Theoretical frameworks drawn from multiple disciplines inform the conceptual foundation of this analysis.",document
"The sample population consisted of 500 participants randomly selected from the target demographic.",document
"Data collection procedures followed strict ethical guidelines approved by the institutional review board.",document
"The regression analysis identified several statistically significant predictor variables influencing the dependent measure.",document
"Limitations of the current study include the relatively small sample size and geographic constraints.",document
"Future research should investigate longitudinal effects and expand the scope to include diverse populations.",document
"The peer review process ensures the academic rigor and validity of published scholarly work.",document
"Citation formatting adheres to the latest edition of the American Psychological Association style guide.",document
"The dissertation contributes original research to the existing body of knowledge in the field.",document
"The terms and conditions govern the contractual relationship between the service provider and the client.",document
"All parties agree to the stipulations outlined herein and acknowledge their binding legal obligations.",document
"The confidentiality agreement prohibits disclosure of proprietary information to unauthorized third parties.",document
"Jurisdiction for any disputes arising from this contract shall be the courts of the state of California.",document
"The indemnification clause protects against liabilities resulting from negligence or breach of contract.",document
"Amendments to this agreement must be executed in writing and signed by authorized representatives.",document
"The severability provision ensures that if any clause is deemed invalid, the remainder stays in effect.",document
"Force majeure circumstances relieve parties from performance obligations due to unforeseeable events.",document
"The statute of limitations for initiating legal action under this agreement is three years from occurrence.",document
"Mediation and arbitration serve as alternative dispute resolution mechanisms prior to litigation.",document
"The clinical trial protocol outlines the randomized controlled study design and inclusion criteria.",document
"Pharmacological interventions demonstrated efficacy in reducing symptoms compared to placebo treatment.",document
"The pathophysiology of the disease involves complex interactions among genetic and environmental factors.",document
"Diagnostic imaging revealed abnormalities consistent with the suspected clinical presentation.",document
"Treatment guidelines recommend a multimodal approach combining medication and behavioral therapy.",document
"The prognosis depends on multiple variables including disease stage and patient comorbidities.",document
"Epidemiological data indicate an increase in incidence rates over the past decade.",document
"The peer-reviewed journal article presents novel findings that challenge existing paradigms.",document
"Laboratory results confirm the presence of biomarkers associated with the pathological condition.",document
"The informed consent process ensures patients understand risks and benefits before participation.",document
"The balance sheet reflects the company's financial position as of the fiscal year ending December 31st.",document
"Cash flow projections indicate sufficient liquidity to meet short-term operational obligations.",document
"The income statement demonstrates profitability trends across multiple reporting periods.",document
"Asset valuation methodologies comply with generally accepted accounting principles.",document
"The investment portfolio is diversified across multiple asset classes to mitigate risk exposure.",document
"Financial ratios provide insights into the company's operational efficiency and leverage.",document
"The audit opinion confirms that the financial statements present a true and fair view.",document
"Revenue recognition policies adhere to the latest accounting standards and regulatory requirements.",document
"The risk assessment identifies potential threats to financial stability and recommends mitigation strategies.",document
"Shareholder equity increased substantially due to retained earnings and capital contributions.",document
"The curriculum objectives align with state educational standards and competency frameworks.",document
"Learning outcomes specify the knowledge and skills students should acquire by course completion.",document
"The pedagogical approach emphasizes active learning strategies and student-centered instruction.",document
"Assessment methodologies include formative evaluations and summative examinations.",document
"Instructional materials are designed to accommodate diverse learning styles and abilities.",document
"The syllabus outlines weekly topics, required readings, and assignment deadlines.",document
"Grading criteria provide transparent standards for evaluating student performance.",document
"The textbook chapter introduces fundamental concepts with illustrative examples and practice problems.",document
"Supplementary resources enhance understanding through multimedia presentations and interactive simulations.",document
"The lesson plan structures classroom activities to maximize engagement and knowledge retention.",document
"The organizational charter establishes the mission, vision, and core values guiding all activities.",document
"Governance structures define roles, responsibilities, and decision-making authority within the institution.",document
"The code of conduct sets forth expected standards of professional behavior and ethical practice.",document
"Compliance monitoring ensures adherence to applicable laws, regulations, and internal policies.",document
"The grievance procedure provides a formal mechanism for addressing complaints and disputes.",document
"Transparency initiatives promote open communication and accountability to stakeholders.",document
"The strategic framework articulates long-term goals and the means for achieving them.",document
"Risk management policies identify potential hazards and establish protocols for mitigation.",document
"The sustainability plan commits the organization to environmentally responsible practices.",document
"Performance evaluation criteria assess effectiveness in meeting established benchmarks.",document
"The project charter formally authorizes the initiative and defines scope, objectives, and stakeholders.",document
"The work breakdown structure decomposes the project into manageable tasks and deliverables.",document
"Resource allocation ensures that personnel, budget, and equipment are distributed optimally.",document
"The critical path analysis identifies task dependencies and determines the minimum project duration.",document
"Risk registers document potential issues along with probability assessments and response strategies.",document
"Status reports provide regular updates on progress, milestones achieved, and challenges encountered.",document
"Change management procedures govern how modifications to scope or requirements are evaluated and approved.",document
"Quality assurance processes verify that deliverables meet specified standards and expectations.",document
"The lessons learned document captures insights for improving future project execution.",document
"The project closeout report summarizes outcomes, successes, and areas for improvement.",document
"The brand positioning statement defines the unique value proposition and target audience.",document
"Market segmentation analysis identifies distinct customer groups based on demographics and behavior.",document
"The communications strategy outlines messaging, channels, and tactics for reaching stakeholders.",document
"Content marketing initiatives create valuable information to attract and engage potential customers.",document
"The media plan allocates advertising budget across traditional and digital platforms.",document
"Public relations activities build and maintain a positive organizational reputation.",document
"Customer journey mapping visualizes touchpoints and interactions throughout the buying process.",document
"Performance indicators measure the effectiveness of marketing campaigns and return on investment.",document
"The crisis communication protocol establishes procedures for responding to negative events.",document
"Brand guidelines ensure consistent visual identity and messaging across all materials.",document
"The employee handbook outlines policies, procedures, and expectations for all staff members.",document
"Job descriptions specify duties, qualifications, and competencies required for each position.",document
"The compensation structure ensures competitive salaries aligned with market benchmarks.",document
"Performance appraisal systems provide regular feedback and identify development opportunities.",document
"The recruitment process includes screening, interviewing, and selection of qualified candidates.",document
"Training programs enhance employee skills and support professional development goals.",document
"Benefits packages include health insurance, retirement plans, and paid time off provisions.",document
"The disciplinary procedure establishes progressive steps for addressing performance issues.",document
"Diversity and inclusion initiatives promote an equitable and respectful workplace culture.",document
"Succession planning identifies and prepares future leaders within the organization.",document
"The environmental impact assessment evaluates potential effects of the proposed project on ecosystems.",document
"Sustainability metrics track progress toward reducing carbon emissions and resource consumption.",document
"The green building certification verifies adherence to environmentally responsible construction standards.",document
"Waste management protocols emphasize reduction, reuse, and recycling of materials.",document
"The climate action plan sets targets for achieving net-zero greenhouse gas emissions.",document
"Biodiversity conservation efforts protect endangered species and preserve natural habitats.",document
"The circular economy model minimizes waste by designing products for longevity and recyclability.",document
"Renewable energy investments support the transition away from fossil fuel dependence.",document
"Environmental compliance ensures operations meet regulatory standards for air and water quality.",document
"The sustainability report discloses environmental performance and corporate responsibility initiatives.",document
"The standard operating procedure documents step-by-step instructions for completing tasks safely and efficiently.",document
"Quality control measures inspect products at various stages to ensure conformance to specifications.",document
"The supply chain management system coordinates the flow of materials from suppliers to customers.",document
"Lean manufacturing principles eliminate waste and optimize production processes.",document
"The maintenance schedule establishes regular intervals for equipment servicing and inspection.",document
"Capacity planning forecasts demand and ensures adequate resources to meet production targets.",document
"The safety protocol identifies hazards and establishes procedures to protect worker health.",document
"Inventory management balances stock levels to minimize costs while preventing shortages.",document
"The production schedule sequences tasks to maximize throughput and minimize downtime.",document
"Continuous improvement initiatives engage employees in identifying and implementing enhancements.",document
"The legislative proposal outlines the purpose, provisions, and expected impact of the bill.",document
"Public hearings provide opportunities for citizens to voice opinions on proposed regulations.",document
"The budget document details projected revenues and expenditures for the fiscal year.",document
"Zoning ordinances regulate land use to promote orderly development and community welfare.",document
"The municipal code compiles laws and regulations governing local jurisdiction.",document
"The transparency portal provides public access to government data and decision-making processes.",document
"Grant funding supports programs that address community needs and priorities.",document
"The emergency management plan establishes protocols for responding to natural disasters.",document
"The constituent services office assists residents with navigating government agencies and programs.",document
"The performance audit evaluates the efficiency and effectiveness of public programs.",document
"The property appraisal determines fair market value based on comparable sales and property characteristics.",document
"The lease agreement stipulates the terms and conditions governing the landlord-tenant relationship.",document
"Title insurance protects against defects in ownership and legal claims to the property.",document
"The home inspection report identifies structural issues and necessary repairs.",document
"Zoning regulations dictate permissible uses for properties within designated areas.",document
"The purchase agreement outlines the sale price, contingencies, and closing timeline.",document
"Property tax assessments determine the annual tax liability based on assessed value.",document
"The homeowners association governs common areas and enforces community standards.",document
