text,label
"The deed conveys ownership rights from the seller to the buyer upon closing.",document
"Market analysis examines trends in property values, sales volume, and buyer demand.",document
"The policy document specifies coverage limits, exclusions, and premium amounts.",document
"The claims process requires timely notification and documentation of losses.",document
"Underwriting guidelines assess risk and determine eligibility for coverage.",document
"The actuarial analysis calculates expected losses and sets appropriate pricing.",document
"Deductibles and co-insurance provisions allocate costs between the insurer and insured.",document
"The beneficiary designation determines who receives proceeds upon a triggering event.",document
"The endorsement modifies the standard policy to add or exclude specific coverages.",document
"Risk mitigation strategies reduce the likelihood and severity of potential losses.",document
"The reinsurance arrangement transfers a portion of risk to another insurance company.",document
"The loss ratio measures claims paid relative to premiums collected.",document
"The event proposal outlines objectives, target audience, and logistical requirements.",document
"The venue contract specifies rental fees, capacity, and available amenities.",document
"The run-of-show document provides a minute-by-minute schedule of event activities.",document
"Vendor agreements cover catering, audio-visual, and other service providers.",document
"The registration system manages attendee sign-ups and tracks participation.",document
"The marketing plan promotes the event through various channels to maximize attendance.",document
"The budget tracks expenses against allocated funds to ensure fiscal responsibility.",document
"Contingency plans address potential issues such as inclement weather or technical failures.",document
"The evaluation survey gathers feedback to assess success and identify improvements.",document
"The post-event report summarizes outcomes, attendance, and financial results.",document
"The feasibility study assesses the viability of the proposed initiative from multiple perspectives.",document
"Benchmarking analysis compares organizational performance against industry standards.",document
"The gap analysis identifies disparities between current state and desired outcomes.",document
"The impact statement evaluates potential consequences of implementing the policy.",document
"The roadmap provides a timeline for achieving strategic objectives over multiple years.",document
"The business case justifies investment by demonstrating anticipated benefits and returns.",document
"The memorandum of understanding establishes a framework for cooperation between entities.",document
"The charter amendment modifies foundational documents to reflect organizational evolution.",document
"The certification program verifies competency through standardized testing and evaluation.",document
"The accreditation process assesses whether institutions meet established quality criteria.",document
"The directive communicates authoritative instructions from leadership to the organization.",document
"The resolution formally expresses the official position or decision of a governing body.",document
"The ordinance enacts local law with penalties for non-compliance.",document
"The proclamation makes a formal public announcement or declaration.",document
"The manifesto articulates principles and intentions guiding a movement or organization.",document
"The doctrine establishes fundamental beliefs or guiding principles.",document
"The covenant creates binding commitments among parties.",document
"The treaty formalizes international agreements between sovereign nations.",document
"The statute codifies law enacted by the legislative branch.",document
"The regulation implements and enforces statutory provisions.",document
"The methodology section describes the research design, data collection procedures, and analytical techniques.",document
"The abstract provides a concise summary of the study's purpose, methods, findings, and conclusions.",document
"The introduction establishes context, identifies the research problem, and states objectives.",document
"The discussion interprets findings in relation to existing literature and theoretical frameworks.",document
"The conclusion synthesizes key points and suggests implications for practice and future research.",document
"The bibliography lists all sources cited in the document using a standardized format.",document
"The appendix includes supplementary materials such as raw data, detailed calculations, and additional graphics.",document
"The table of contents organizes the document structure and provides page references for navigation.",document
"The glossary defines technical terms and jargon used throughout the document.",document
"The index alphabetically lists topics and keywords with corresponding page numbers.",document
"The acknowledgments recognize individuals and organizations that contributed to the work.",document
"The disclaimer limits liability and clarifies the scope of responsibility.",document
"The copyright notice asserts intellectual property rights and usage permissions.",document
"The revision history tracks changes made to the document over time.",document
"The distribution list identifies authorized recipients of the document.",document
"The classification marking indicates the sensitivity level of the information.",document
"The executive briefing condenses complex information for decision-makers.",document
"The technical specification defines precise requirements for design and implementation.",document
"The user manual provides instructions for operating equipment or software.",document
"The troubleshooting guide helps diagnose and resolve common problems.",document
"The reference guide offers quick access to key information and procedures.",document
"The training manual structures learning materials for skill development.",document
"The certification document verifies that standards have been met.",document
"The compliance report demonstrates adherence to regulatory requirements.",document
"The audit trail documents transactions and activities for accountability.",document
"The baseline establishes a reference point for measuring change.",document
"The milestone marker identifies significant achievements in project progression.",document
"The deliverable represents a tangible output required by a specific date.",document
"The acceptance criteria define conditions that must be met for approval.",document
"The assumptions document underlying premises that influence planning.",document
"The constraints identify limitations affecting project scope and execution.",document
"The dependencies map relationships between tasks and activities.",document
"The escalation procedure outlines steps for addressing unresolved issues.",document
"The governance model defines authority structures and decision rights.",document
"The operating agreement establishes rules for business entity management.",document
"The franchise agreement grants rights to operate under an established brand.",document
"The service level agreement specifies performance standards and remedies.",document
"The memorandum documents internal communications and decisions.",document
"The brief summarizes key information for quick reference.",document
"The docket lists cases scheduled for legal proceedings.",document
"The transcript provides a written record of spoken proceedings.",document
"The affidavit is a sworn statement of facts.",document
"The deposition records testimony given under oath outside of court.",document
"The subpoena compels appearance or production of evidence.",document
"The injunction orders a party to take or refrain from specific actions.",document
"The stipulation represents an agreement between parties on certain facts.",document
"The motion requests a ruling or order from the court.",document
"The ruling announces the court's decision on a matter.",document
"The judgment is the final determination of rights and obligations.",document
"The settlement agreement resolves disputes without trial.",document
"The release waives rights to pursue further legal action.",document
"This market analysis examines current trends and projected growth patterns in the semiconductor industry.",document
"The white paper outlines our proposed framework for sustainable urban development.",document
"Technical specifications require minimum 16GB RAM and dedicated graphics processing unit.",document
"According to the latest research findings, patient outcomes improved by 34% with the new protocol.",document
"The environmental impact assessment identifies three critical areas requiring immediate attention.",document
"Manufacturing procedures must comply with ISO 9001 quality management standards.",document
"The feasibility study demonstrates positive ROI potential within the first 18 months.",document
"Strategic recommendations include diversification of supply chain and expansion into emerging markets.",document
"Risk mitigation strategies should address cybersecurity vulnerabilities and data protection compliance.",document
"The literature review synthesizes findings from 47 peer-reviewed studies published between 2020-2024.",document
"Implementation guidelines provide step-by-step instructions for system deployment and configuration.",document
"The case study examines successful adoption of agile methodologies in enterprise environments.",document
"Quality assurance protocols mandate testing at multiple checkpoints throughout the production cycle.",document
"The operational manual documents standard operating procedures for equipment maintenance and safety.",document
"Competitive analysis reveals market opportunities in the mid-tier customer segment.",document
"The research methodology employs both quantitative surveys and qualitative interviews.",document
"Key performance indicators track progress against established benchmarks and targets.",document
"The executive briefing summarizes critical decision points requiring board approval.",document
"Documentation standards require version control and change management procedures.",document
"The technical architecture supports horizontal scaling and fault-tolerant operation.",document
"Best practices recommend regular security audits and penetration testing.",document
"The budget proposal allocates resources across personnel, technology, and marketing initiatives.",document
"Compliance requirements include GDPR, HIPAA, and SOX regulatory frameworks.",document
"The training curriculum covers fundamental concepts through advanced practical applications.",document
"Performance metrics indicate 99.9% uptime and sub-second response times.",document
"The project charter defines scope, objectives, deliverables, and success criteria.",document
"Gap analysis identifies discrepancies between current state and desired future state.",document
"The procurement policy establishes vendor selection criteria and approval workflows.",document
"Data governance frameworks ensure data quality, security, and regulatory compliance.",document
"The disaster recovery plan includes backup procedures and failover mechanisms.",document
"Stakeholder engagement strategy prioritizes communication with key decision-makers.",document
"The business continuity plan addresses critical operations during disruption scenarios.",document
"Change management procedures facilitate smooth transition to new systems and processes.",document
"The sustainability report documents progress toward environmental and social responsibility goals.",document
"Service level agreements specify performance standards, response times, and remediation procedures.",document
"The knowledge base contains troubleshooting guides, FAQs, and best practice documentation.",document
"Organizational structure defines reporting relationships, roles, and responsibilities.",document
"The strategic roadmap outlines multi-year initiatives and milestones.",document
"Information architecture organizes content taxonomy and navigation pathways.",document
"The requirements specification details functional and non-functional system capabilities.",document
"Testing protocols validate functionality, performance, security, and usability requirements.",document
"The migration plan addresses data conversion, system integration, and cutover procedures.",document
"Process optimization analysis identifies bottlenecks and efficiency improvement opportunities.",document
"The vendor evaluation matrix compares capabilities, pricing, and implementation timelines.",document
"Security policy establishes access controls, authentication requirements, and encryption standards.",document
"The user manual provides comprehensive instructions for system operation and configuration.",document
"Incident response procedures outline detection, containment, and recovery steps.",document
"The integration guide documents API specifications, data formats, and communication protocols.",document
"Capacity planning analysis projects resource requirements based on growth forecasts.",document
"The maintenance schedule specifies routine inspections, updates, and preventive measures.",document
"Governance framework defines decision authority, accountability, and oversight mechanisms.",document
"The impact assessment evaluates potential consequences of proposed changes.",document
"Performance tuning recommendations optimize system efficiency and resource utilization.",document
"The operations runbook contains procedures for common tasks and troubleshooting scenarios.",document
"Financial projections model revenue, expenses, and profitability under various scenarios.",document
"The certification guide prepares candidates for professional credential examinations.",document
"Audit trail documentation maintains comprehensive records of system activities and changes.",document
"The reference architecture provides templates and patterns for solution design.",document
"Escalation procedures define communication channels and response protocols for critical issues.",document
"The deployment checklist ensures all prerequisite tasks are completed before release.",document
"Configuration management tracks hardware, software, and documentation baselines.",document
"The validation report certifies that deliverables meet specified requirements and standards.",document
"Lessons learned documentation captures insights and recommendations for future projects.",document
"The system inventory maintains current records of all IT assets and licenses.",document
"Onboarding materials guide new employees through policies, procedures, and resources.",document
"The communication plan specifies messages, audiences, channels, and timing.",document
"Dependency mapping identifies critical relationships between systems and processes.",document
"The testing strategy defines approach, scope, resources, and acceptance criteria.",document
"Post-implementation review evaluates project outcomes against original objectives.",document
"The standards document establishes coding conventions, naming patterns, and file organization.",document
"Security assessment identifies vulnerabilities, threats, and recommended countermeasures.",document
"The resource allocation plan assigns personnel and equipment to project activities.",document
"Metrics dashboard visualizes key indicators for operational monitoring and analysis.",document
"The transition plan facilitates knowledge transfer and responsibility handover.",document
"System requirements specify hardware, software, network, and environmental prerequisites.",document
"The retention policy defines archival periods and disposal procedures for records.",document
"Interface specifications document data exchange formats and communication protocols.",document
"The contingency plan addresses alternative approaches if primary strategies fail.",document
"Release notes communicate new features, enhancements, and resolved issues.",document
"The workflow diagram illustrates process steps, decision points, and responsibilities.",document
"Benchmark analysis compares performance against industry standards and competitors.",document
"The glossary defines technical terms and acronyms used throughout documentation.",document
"Access control matrix specifies user permissions for system resources and functions.",document
"The architecture decision record documents significant design choices and rationale.",document
"Monitoring procedures track system health, performance, and availability metrics.",document
"The installation guide provides step-by-step instructions for software deployment.",document
"Data dictionary describes database tables, fields, relationships, and constraints.",document
"The review criteria establish evaluation standards for deliverable acceptance.",document
"Integration testing validates interactions between system components and external interfaces.",document
"The runbook automation scripts reduce manual intervention for routine operations.",document
"Stakeholder analysis identifies interests, influence, and engagement strategies.",document
"The deprecation notice announces planned removal of legacy features and migration paths.",document
"Version history tracks changes, enhancements, and fixes across software releases.",document
"The FAQ document addresses common questions and provides standardized responses.",document
"Acceptance testing verifies that system meets business requirements and user expectations.",document
"The troubleshooting matrix correlates symptoms with probable causes and solutions.",document
"Load testing evaluates system behavior under expected and peak usage conditions.",document
"The comparison chart presents side-by-side evaluation of alternative solutions.",document
"Data migration validates completeness, accuracy, and integrity of transferred information.",document
"Just shipped our new feature! Love seeing users respond",social
"Can't believe it's already Friday! Weekend vibes starting early",social
"Excited to announce I'm joining the team at TechCorp!",social
"Beautiful sunset tonight, had to share",social
"New blog post is live! Check it out and let me know what you think",social
"Grateful for this amazing community",social
"Quick poll: coffee or tea?",social
"Absolutely loving this new album on repeat",social
"Travel tip: always pack an extra charger",social
"Celebrating 1 year at the company today!",social
"Big news coming soon, stay tuned",social
"Throwback to last summer's adventure",social
"Monday motivation: you got this",social
"Currently reading this fantastic book, highly recommend",social
"Life update: moved to a new city and loving it so far",social
"Random thought: why do we park in driveways and drive on parkways",social
"Workout complete, feeling accomplished",social
"Anyone else completely obsessed with this show",social
"Just launched my side project, feedback welcome",social
"Thankful for amazing friends and family",social
"10 lessons learned from my first year as a founder",social
"Here's why I switched from React to Vue",social
"The future of remote work is here to stay",social
"Unpopular opinion: meetings are actually productive when done right",social
"5 books that changed how I think about leadership",social
"Breaking down the latest industry trends",social
"What I wish I knew before starting my career",social
"The one skill that matters most in tech",social
"How I 10x'd my productivity this year",social
"Excited to speak at the conference next month",social
"Your only limit is you",social
"Progress over perfection",social
"Small steps lead to big changes",social
"Believe in yourself and anything is possible",social
"The best time to start was yesterday, the next best time is now",social
"Success is not final, failure is not fatal",social
"Dream big, start small, act now",social
"You are capable of amazing things",social
"Every expert was once a beginner",social
"Growth happens outside your comfort zone",social
"What's your favorite productivity hack?",social
"Drop your best life advice below",social
"Tell me something that made you smile today",social
"What's the best purchase you've made this year?",social
"Share your unpopular opinion",social
"What are you working on right now?",social
"What's one thing you're grateful for today?",social
"If you could master one skill instantly, what would it be?",social
"What's your go-to comfort food?",social
"Where's your dream vacation destination?",social
"Hit 10k followers today! Thank you all",social
"We did it team! Project complete",social
"Just crossed 100 episodes of the podcast",social
"One year smoke-free today",social
"Graduated today! On to the next chapter",social
"Ran my first marathon!",social
"Promoted to senior engineer!",social
"Finally hit my fitness goal",social
"Published my first article",social
"Launched my first product",social
"Here's what a day in my life looks like",social
"The reality behind the highlight reel",social
"Taking you behind the scenes of our shoot",social
"This is how we make it happen",social
"Raw and unfiltered: the truth about entrepreneurship",social
"What nobody tells you about",social
"The messy middle of building something great",social
"Process over product",social
"Here's what went wrong and what we learned",social
"The real story behind the success",social
"You need to try this restaurant",social
"Best purchase I've made all year",social
"If you haven't watched this yet, you're missing out",social
"Game-changing app I just discovered",social
"Must-read book of the year",social
"Life-changing advice from a mentor",social
"Product review: totally worth it",social
"Hidden gem I found in the city",social
"Podcast recommendation",social
"Tool that saves me hours every week",social
"When you realize it's only Tuesday",social
"Me pretending I understand what's happening in meetings",social
"That feeling when your code works on the first try",social
"POV: you just deployed to production on a Friday",social
"Nobody: Me at 2am with a new project idea",social
"My bank account after online shopping",social
"Expectation vs Reality",social
"This is too accurate",social
"I feel personally attacked",social
"Why is this so relatable",social
"Breaking: here's what you need to know",social
"Hot take on today's announcement",social
"Let's talk about what just happened",social
"Thoughts on the latest update?",social
"This changes everything",social
"The internet is buzzing about this",social
"Here's my take on the situation",social
"Important conversation we need to have",social
"This deserves more attention",social
"Pay attention to this",social
"It's time we talk about mental health",social
"Raising awareness for an important cause",social
"Support small businesses",social
"Sustainability matters",social
"Diversity and inclusion isn't optional",social
"Climate action starts with us",social
"Education is a right, not a privilege",social
"Stand up for what's right",social
"Your voice matters",social
"Together we can make a difference",social
"Live from the conference",social
"Watching this happen in real time",social
"Updates coming throughout the day",social
"Happening now",social
"Stay tuned for more",social
"This is unfolding fast",social
"Breaking news",social
"Real-time coverage",social
"As it happens",social
"Live updates",social
"Couldn't have done this without you all",social
"Special thanks to everyone who supported",social
"Grateful for this opportunity",social
"Appreciation post for my team",social
"Thank you for believing in me",social
"Shoutout to the amazing people in my life",social
"Blessed and grateful",social
"Thankful for every moment",social
"You all make this worthwhile",social
"Forever grateful",social
"Real talk: this has been hard",social
"Vulnerability post",social
"Struggling but still showing up",social
"It's okay to not be okay",social
"The tough days make you stronger",social
"Sharing my struggle in hopes it helps someone",social
"Mental health check-in",social
"Being honest about the challenges",social
"Growth is uncomfortable",social
"Embracing the journey, bumps and all",social
"Drop a hi if you're new here",social
"Let's connect!",social
"Building this community together",social
"Tag someone who needs to see this",social
"Share this if you agree",social
"Join the conversation",social
"What does this community mean to you?",social
"Let's support each other",social
"Stronger together",social
"This is a safe space",social
"Link in bio",social
"Swipe for more",social
"Click the link to learn more",social
"Sign up now",social
"Limited time offer",social
"Don't miss out",social
"Register today",social
"Join us",social
"Get started",social
"Take action",social
"Building in public",social
"My journey so far",social
"What I stand for",social
"This is what I'm about",social
"My why",social
"The story behind the brand",social
"Mission-driven",social
"Authentic over perfect",social
"Staying true to my values",social
"This is me",social
"Morning routine that changed my life",social
"What I eat in a day",social
"Outfit of the day",social
"Home office setup tour",social
"My skincare routine",social
"Weekend reset",social
"Self-care Sunday",social
"Meal prep ideas",social
"Capsule wardrobe essentials",social
"Minimalist living",social
"The state of the industry in 2024",social
"Trends to watch next year",social
"What's changing in our space",social
"Data-driven insights",social
"Market analysis",social
"Expert perspective on",social
"What the numbers tell us",social
"Industry forecast",social
"Competitive landscape",social
"Innovation spotlight",social
"Behind the camera",social
"How I edit my photos",social
"Content creation tips",social
"My filming setup",social
"Creative process revealed",social
"Tools I use every day",social
"How to grow your audience",social
"Lessons from creating content",social
