text,label
"Dear hiring manager, I am writing to express my interest in the software engineering position at your company.",email
"Dear Sir or Madam, I would like to inquire about the status of my application submitted last week.",email
"Dear colleagues, Please find attached the quarterly report for your review.",email
"Dear team, I wanted to follow up on our discussion from yesterday's meeting regarding the project timeline.",email
"Dear Dr. Smith, Thank you for taking the time to speak with me about the research opportunity.",email
"Dear Customer Service, I am writing to request a refund for order number 12345.",email
"Dear valued customer, We are pleased to inform you about our new product launch.",email
"Dear Board Members, I am writing to provide an update on the company's financial performance.",email
"Dear Professor Johnson, I hope this email finds you well. I wanted to discuss my thesis proposal.",email
"Dear Support Team, I am experiencing technical difficulties with your software application.",email
"Good morning, I am reaching out regarding the upcoming conference scheduled for next month.",email
"Hello, I would like to schedule a meeting to discuss the partnership opportunity.",email
"Greetings, I am writing on behalf of our organization to request your participation.",email
"Dear friends and family, We are excited to announce our upcoming wedding celebration.",email
"Dear Editor, I am submitting my manuscript for consideration in your journal.",email
"To whom it may concern, I am writing to provide a reference for my former colleague.",email
"Dear recruiter, I came across your job posting and believe I would be a great fit.",email
"Dear Alumni, We cordially invite you to our annual reunion event.",email
"Dear subscribers, We wanted to update you on some changes to our service.",email
"Dear participants, Thank you for registering for our workshop next week.",email
"Dear Hiring Manager, I am excited to apply for the Marketing Director position advertised on LinkedIn.",email
"To the Recruitment Team, Please consider my application for the Data Analyst role at your organization.",email
"Dear Ms. Williams, I am writing to express my strong interest in joining your engineering team.",email
"Good afternoon, I would like to submit my resume for the Project Manager opening.",email
"Dear HR Department, I am a recent graduate interested in your management trainee program.",email
"Respected Sir, I wish to apply for the position of Senior Developer as advertised in your company.",email
"Dear Selection Committee, Please find enclosed my application materials for the research fellowship.",email
"To the hiring panel, I am writing to apply for the Senior Consultant position in your firm.",email
"Dear Talent Acquisition Team, I am reaching out regarding career opportunities at your company.",email
"Good morning, I would like to be considered for the UX Designer role currently available.",email
"Dear Support, I purchased your product last month and it has stopped working properly.",email
"To Customer Care, I need assistance with tracking my order that was placed two weeks ago.",email
"Dear Service Team, I would like to report an issue with my recent billing statement.",email
"Hello, I am writing to request a replacement for the defective item I received.",email
"Dear Technical Support, I am having trouble logging into my account despite multiple attempts.",email
"Good evening, I would like to cancel my subscription effective immediately.",email
"Dear Claims Department, I am filing a claim for damage that occurred during shipping.",email
"To the billing team, Please review the charges on my account as there appears to be an error.",email
"Dear Manager, I had an unsatisfactory experience at your store location and would like to discuss.",email
"Hello Support, I need help recovering access to my account after forgetting my password.",email
"Dear Mr. Thompson, Thank you for your proposal. We have reviewed it carefully and would like to proceed.",email
"Good morning colleagues, Please review the attached documents before our meeting tomorrow.",email
"Dear Partners, We are writing to inform you of upcoming changes to our partnership agreement.",email
"To all staff members, Please note that the office will be closed next Monday for the holiday.",email
"Dear Vendors, We are requesting updated quotes for the services outlined in the attached RFP.",email
"Good afternoon, I am writing to confirm our appointment scheduled for next Tuesday at 2 PM.",email
"Dear Executive Team, Please find the monthly performance report attached for your review.",email
"To whom it may concern, This letter serves as verification of employment for the named individual.",email
"Dear Client, We wanted to update you on the progress of your project as of today's date.",email
"Good morning, I am pleased to inform you that your application has been approved.",email
"Dear Professor Martinez, I am writing to request a letter of recommendation for graduate school.",email
"Good evening, I would like to discuss the possibility of joining your research group.",email
"Dear Committee Members, Please accept my thesis proposal for your consideration.",email
"Hello Dr. Chen, I wanted to follow up on my question from class regarding the assignment.",email
"Dear Academic Advisor, I need guidance on course selection for next semester.",email
"Good morning Professor, I am unable to attend tomorrow's lecture due to a medical appointment.",email
"Dear Department Chair, I am writing to formally appeal my grade in the economics course.",email
"To the Admissions Office, I would like to inquire about the application deadline for Fall admission.",email
"Dear Scholarship Committee, Please consider my application for the merit-based scholarship.",email
"Good afternoon, I am requesting permission to audit your advanced seminar course.",email
"Dear Ms. Rodriguez, I came across your profile and would love to connect regarding industry opportunities.",email
"Good morning, A mutual colleague suggested I reach out to you about potential collaboration.",email
"Dear Industry Professional, I admire your work in the field and would appreciate the chance to learn from you.",email
"Hello, I attended your presentation at the conference and found it incredibly insightful.",email
"Dear Mentor, I am seeking career guidance and wondered if you might have time for a brief call.",email
"Good evening, I noticed we share similar professional interests and thought we should connect.",email
"Dear Colleague, I am organizing a panel discussion and would be honored if you could participate.",email
"To the event organizer, I would like to inquire about speaking opportunities at your upcoming conference.",email
"Dear Connection, I hope this message finds you well. I wanted to reconnect after several years.",email
"Good morning, I am reaching out on behalf of our professional association to extend an invitation.",email
"Dear Prospect, I wanted to share how our solution could benefit your organization.",email
"Good afternoon, Thank you for your interest in our products. I would love to schedule a demo.",email
"Dear Business Owner, I represent a company that specializes in services that might interest you.",email
"Hello, I noticed your company is expanding and thought our services could support your growth.",email
"Dear Decision Maker, I would like to introduce you to an innovative solution for your industry.",email
"Good morning, Following up on our conversation last week about your technology needs.",email
"Dear Valued Partner, We are excited to announce exclusive offers available to our partners.",email
"To the procurement team, Please find our competitive pricing proposal attached.",email
"Dear Client, I wanted to check in and see how you are enjoying our service so far.",email
"Good afternoon, We have a limited-time promotion that I thought would interest you.",email
"Dear Team Members, I am pleased to announce the promotion of Sarah Johnson to Senior Manager.",email
"Good morning everyone, Please join us in welcoming our new team member starting Monday.",email
"Dear Colleagues, We are hosting a town hall meeting next Thursday to discuss company updates.",email
"To all employees, The annual performance review process will begin next month.",email
"Dear Staff, We are implementing new security protocols effective immediately.",email
"Good afternoon team, I wanted to share some exciting news about our recent achievements.",email
"Dear Community, We are thrilled to announce the opening of our new location.",email
"To valued customers, Please be advised of scheduled maintenance this weekend.",email
"Dear Members, The annual general meeting will take place on the first Friday of next month.",email
"Good morning, We are making changes to our operating hours starting next week.",email
"Dear Ms. Baker, Following up on my previous email regarding the proposal I submitted.",email
"Good morning, I wanted to check if you had a chance to review the documents I sent last week.",email
"Dear Team, Just circling back on the action items from our last meeting.",email
"Hello, I hope you received my earlier message about scheduling a call to discuss next steps.",email
"Dear Sir, I am writing to follow up on my job application submitted two weeks ago.",email
"Good afternoon, Checking in to see if you need any additional information from me.",email
"Dear Client, I wanted to ensure you received the invoice I sent on Monday.",email
"To the committee, Following up to see if there are any questions about my proposal.",email
"Dear Manager, I wanted to revisit our discussion about the project timeline.",email
"Good morning, Just wanted to touch base regarding the meeting we discussed.",email
"Dear Interview Panel, Thank you for taking the time to meet with me yesterday.",email
"Good afternoon, I wanted to express my gratitude for your help with the project.",email
"Dear Mentor, Thank you so much for your guidance and support throughout this process.",email
"Hello, I appreciate you taking the time to review my work and provide feedback.",email
"Dear Colleagues, Thank you for your collaboration on this successful initiative.",email
"Good morning, I am grateful for the opportunity to contribute to this important project.",email
"Dear Client, Thank you for choosing our services. We appreciate your business.",email
"To the organizing committee, Thank you for inviting me to speak at your event.",email
"Dear Professor, I wanted to thank you for writing a letter of recommendation for me.",email
"Good evening, Thank you for your prompt response to my inquiry.",email
"Dear Team, I would like to schedule a meeting to discuss our Q4 strategy.",email
"Good morning, Are you available for a 30-minute call next Tuesday to review progress?",email
"Dear Stakeholders, Please let me know your availability for a project kickoff meeting.",email
"Hello, I would like to arrange a time to discuss the proposal in more detail.",email
"Dear Manager, Could we schedule a one-on-one to discuss my performance review?",email
"Good afternoon, I am coordinating schedules for our monthly team meeting.",email
"Dear Client, Would you be available for a checkpoint meeting next week?",email
"To all participants, Please confirm your attendance for the workshop on Friday.",email
"Dear Committee, I am proposing we meet to finalize the budget before month-end.",email
"Good morning, Let me know if you have time this week to go over the results.",email
"Dear Team, I apologize for the error in my previous email. The correct date is next Thursday.",email
"Good morning, Please disregard my last message. I am sending the updated version now.",email
"Dear Client, I sincerely apologize for the delay in responding to your request.",email
"Hello, I wanted to correct the information I provided earlier about the meeting time.",email
"Dear Manager, I apologize for missing the deadline. Here is the completed work.",email
"Good afternoon, Please note the correction to the attached document I sent this morning.",email
"Dear Colleagues, I regret the confusion caused by my earlier communication.",email
"To all recipients, I apologize for the technical issues during today's presentation.",email
"Dear Customer, We sincerely regret the inconvenience this has caused you.",email
"Good evening, I wanted to clarify a point I made in my previous email.",email
"Dear Selection Panel, I am honored to be considered for this prestigious award.",email
"Good morning Director, I am writing to request approval for the proposed budget increase.",email
"Dear Investor, I would like to present our quarterly earnings and strategic outlook.",email
"Hello Administrator, I need assistance updating my contact information in the system.",email
"Dear Community Members, We are seeking volunteers for our upcoming charity event.",email
"Good afternoon Coordinator, Please add me to the distribution list for project updates.",email
"Dear Reviewer, Thank you for your thorough evaluation of the manuscript.",email
"To the Board, I am submitting my resignation effective two weeks from today.",email
"Dear Supplier, We would like to renegotiate the terms of our current contract.",email
"Good morning Associate, I wanted to introduce you to a potential client contact.",email
"Dear Participant, This email confirms your registration for the training session.",email
"Hello Executive, I am forwarding a request that requires your immediate attention.",email
"Dear Delegate, We look forward to your participation in the summit next month.",email
"Good afternoon Chairperson, Please find the agenda for next week's board meeting attached.",email
"Dear Applicant, We have received your application and will be in touch soon.",email
"To all attendees, Please complete the feedback survey about yesterday's workshop.",email
"Dear Colleague, I wanted to share an article that relates to our current project.",email
"Good morning Manager, I am requesting time off for the dates specified below.",email
"Dear Administrator, Please update my emergency contact information as indicated.",email
"Hello Team Lead, I wanted to flag a potential issue with the current timeline.",email
"Dear IT Department, I need access to the shared drive for the marketing team.",email
"Good morning HR, I would like to enroll in the professional development course.",email
"Dear Finance Team, Please process the reimbursement for my business travel expenses.",email
"Hello Facilities, We need to report a maintenance issue in conference room B.",email
"Dear Legal, I am requesting a review of the contract before signing.",email
"Good afternoon Security, I need a replacement access card for the building.",email
"Dear Payroll, There appears to be a discrepancy in my last paycheck.",email
"To the training coordinator, I would like to register for the upcoming certification program.",email
"Dear Benefits Administrator, I need to make changes to my health insurance coverage.",email
"Good morning Reception, Please update the visitor access list to include these names.",email
"Dear Organizer, This email confirms my attendance at the conference next month.",email
"Good afternoon, I am writing to confirm receipt of the documents you sent yesterday.",email
"Dear Client, Confirming our meeting scheduled for next Tuesday at 10 AM.",email
"Hello, I can confirm that the payment has been processed successfully.",email
"Dear Team, Confirming that I have completed my assigned tasks for this sprint.",email
"Good morning, This serves as confirmation of your reservation for the event.",email
"Dear Customer, We confirm that your order has been shipped and is in transit.",email
"To the coordinator, Confirming my availability for the dates you proposed.",email
"Dear Manager, I confirm my acceptance of the position offered in your letter.",email
"Good evening, Confirming that I have received and reviewed the updated contract.",email
"Dear New Team Member, Welcome aboard! I wanted to introduce myself and offer assistance.",email
"Good morning Everyone, I am pleased to introduce our new director of operations.",email
"Dear Client, I would like to introduce you to your new account manager.",email
"Hello, My name is Jennifer and I will be your point of contact going forward.",email
"Dear Colleagues, Please join me in welcoming the newest member of our team.",email
"Good afternoon, I am writing to introduce myself as the new project lead.",email
"Dear Partners, I wanted to introduce our company and explore collaboration opportunities.",email
"To the team, Let me introduce you to the consultant who will be joining us.",email
"Dear Network, I am excited to introduce my new business venture.",email
"Good morning, I would like to introduce you to a colleague who shares your interests.",email
"Dear Team, This is a reminder that the project deadline is approaching next Friday.",email
"Good morning, Just a friendly reminder about our meeting scheduled for this afternoon.",email
"Dear Participants, Reminder to submit your registration forms by end of day.",email
"Hello, This is a reminder that your subscription renewal is due next week.",email
"Dear Colleague, Reminder to complete your annual compliance training by month-end.",email
"Good afternoon, Please remember to submit your expense reports before the deadline.",email
"Dear Members, Reminder that membership dues are payable at the beginning of each quarter.",email
"To all staff, This is a reminder about the new parking policy effective next Monday.",email
"Dear Client, Friendly reminder that your appointment is scheduled for tomorrow.",email
"Good morning, Reminder to review the attached document before our call.",email
"Dear Records Department, I am requesting copies of documents related to my account.",email
"Good afternoon, Could you please provide me with the contact information for the manager?",email
"Dear Team, I need the latest version of the project specifications document.",email
"Hello, I am looking for information about the application process for this program.",email
"Dear Coordinator, Please send me the schedule for next month's training sessions.",email
"Good morning, I would like to request detailed information about your pricing structure.",email
"Dear Registrar, I need an official transcript sent to the address provided.",email
"To the helpdesk, Can you please provide instructions for resetting my password?",email
"Dear Librarian, I am requesting access to the archived materials from last year.",email
"Good afternoon, I need clarification on the requirements listed in your announcement.",email
"Dear Committee, I am pleased to recommend Dr. Anderson for the research grant.",email
"Good morning, I am writing this letter of reference for my former student.",email
"Dear Hiring Manager, It is my pleasure to recommend Sarah for the position.",email
"Hello, I wanted to provide a reference for John who worked under my supervision.",email
"Dear Selection Committee, I wholeheartedly endorse this candidate's application.",email
"Good afternoon, I am happy to serve as a professional reference for this individual.",email
"Dear Admissions, I strongly recommend this student for admission to your program.",email
"To whom it may concern, I am writing to recommend this organization for the award.",email
"Dear Panel, Based on my experience working with them, I highly recommend approval.",email
"Good morning, I am providing this character reference for a valued colleague.",email
"Dear Decision Makers, I am submitting a proposal for your consideration.",email
"Good afternoon, I would like to present an innovative solution to your current challenge.",email
"Dear Client, Please review the attached proposal for the upcoming project.",email
"Hello, I am pitching an idea that I believe aligns with your strategic goals.",email
"Dear Investors, I am seeking funding for a venture that addresses a market need.",email
"Good morning, I would like to propose a partnership that benefits both organizations.",email
"Dear Committee, I am submitting a grant proposal for research in this field.",email
"To the board, I am presenting a business case for expansion into new markets.",email
"Dear Stakeholders, Please consider this proposal for improving operational efficiency.",email
"Good evening, I wanted to share a concept that could enhance your current offering.",email
"Dear Customers, We are writing to notify you of important changes to our terms of service.",email
"Good morning Team, I wanted to update everyone on the status of the current project.",email
"Dear Users, Please be aware that system maintenance is scheduled for this weekend.",email
"Hello Members, We are pleased to announce new features available in your account.",email
"Dear Subscribers, This email contains important information about your subscription.",email
"Good afternoon, I wanted to keep you informed about recent developments.",email
"Dear Clients, We are updating our privacy policy to comply with new regulations.",email
"To all employees, Please note that the employee handbook has been revised.",email
"Dear Community, We wanted to share an update on our sustainability initiatives.",email
"Good morning, I am writing to inform you of a change in our meeting schedule.",email
"Dear Colleague, You are cordially invited to our annual awards ceremony.",email
"Good afternoon, We would be honored if you could join us for a networking reception.",email
"Dear Guest, Please accept this invitation to our exclusive product launch event.",email
"Hello, We are hosting a webinar next week and would love for you to attend.",email
"Dear Speaker, We would like to invite you to present at our upcoming conference.",email
"Good morning, You are invited to participate in our industry roundtable discussion.",email
"Dear VIP, We are pleased to extend an invitation to our private event.",email
"To valued partners, Please join us for a celebration of our company's milestone.",email
"Dear Alumni, You are invited to attend our reunion and networking event.",email
"Good evening, We cordially invite you to our charity gala supporting local causes.",email
"Dear Party, Please review the attached contract and provide your signed copy.",email
"Good morning, I am forwarding the legal agreement for your review and signature.",email
"Dear Counsel, I am requesting legal advice regarding the terms of this agreement.",email
"Hello, Please find enclosed the non-disclosure agreement for your records.",email
"Dear Signatory, We need your approval on the revised contract terms.",email
"Good afternoon, The licensing agreement has been finalized and is attached.",email
"Dear Contractor, Please execute the attached service agreement at your earliest convenience.",email
"To legal department, I need assistance drafting a vendor contract.",email
"Dear Parties, This letter confirms the terms we discussed and agreed upon.",email
"Good morning, Please review and acknowledge receipt of the updated terms and conditions.",email
"Dear Manager, Please find attached my weekly progress report for your review.",email
"Good afternoon, I am submitting the completed assignment ahead of the deadline.",email
"Dear Committee, Enclosed is my final report on the research project.",email
"Hello, I wanted to share the results of the analysis we conducted last month.",email
"Dear Supervisor, Here is the summary of this quarter's performance metrics.",email
"Good morning, I am submitting my expense report for approval.",email
"Dear Team Lead, Please review the attached status update on current initiatives.",email
"To the review board, I am submitting documentation as requested for the audit.",email
"Dear Director, The annual compliance report has been completed and is attached.",email
"Good evening, I wanted to provide an update on the action items from our meeting.",email
"Dear Management, I am writing to formally complain about the service I received.",email
"Good morning, I would like to escalate an issue that has not been resolved.",email
"Dear Supervisor, I need to report a concern about workplace safety conditions.",email
"Hello, I am dissatisfied with the response to my previous inquiry.",email
"Dear Corporate Office, I am filing a formal complaint regarding this matter.",email
"Good afternoon, I would like to bring to your attention a recurring problem.",email
"Dear Customer Relations, I am extremely disappointed with my recent experience.",email
"To the quality assurance team, I am reporting a defect in the product I received.",email
"Dear Manager, I need to address a serious issue that requires immediate attention.",email
"Good morning, I am requesting escalation to a supervisor for this unresolved issue.",email
"Dear Family, Please accept my deepest condolences during this difficult time.",email
"Good afternoon, I was saddened to hear about your loss and wanted to reach out.",email
"Dear Colleague, My thoughts are with you and your family during this time.",email
"Hello, I wanted to express my sympathy for the challenges you are facing.",email
"Dear Friend, I am keeping you in my thoughts and prayers.",email
"Good morning, Please know that we are here to support you however we can.",email
"Dear Team Member, We are thinking of you during this difficult period.",email
"To the bereaved, Our organization extends its heartfelt condolences.",email
"Dear Associate, I am sorry to learn of your recent loss.",email
"Good evening, Please accept our sincere sympathies during this time of sorrow.",email
"Dear Graduate, Congratulations on this outstanding achievement!",email
"Good morning, I wanted to personally congratulate you on your well-deserved promotion.",email
"Dear Winner, Congratulations on being selected for this prestigious award.",email
"Hello, I am thrilled to hear about your success and wanted to send my congratulations.",email
"Dear New Parents, Congratulations on the arrival of your beautiful baby!",email
